{
  "$schema": "https://json-schema.org/draft/2020-12/schema",
  "$id": "https://gobl.org/draft-0/tax/addon-def",
  "$ref": "#/$defs/tax.AddonDef",
  "$defs": {
    "tax.AddonDef": {
      "properties": {
        "key": {
          "$ref": "https://gobl.org/draft-0/cbc/key",
          "title": "Key",
          "description": "Key that defines how to uniquely identify the add-on."
        },
        "requires": {
          "items": {
            "$ref": "https://gobl.org/draft-0/cbc/key"
          },
          "type": "array",
          "title": "Requires",
          "description": "Additional addons that this one depends on to operate correctly."
        },
        "name": {
          "$ref": "https://gobl.org/draft-0/i18n/string",
          "title": "Name",
          "description": "Name of the add-on."
        },
        "description": {
          "$ref": "https://gobl.org/draft-0/i18n/string",
          "title": "Description",
          "description": "Description of the add-on."
        },
        "sources": {
          "items": {
            "$ref": "https://gobl.org/draft-0/cbc/source"
          },
          "type": "array",
          "title": "Sources",
          "description": "Sources of the data used to define the add-on."
        },
        "extensions": {
          "items": {
            "$ref": "https://gobl.org/draft-0/cbc/definition"
          },
          "type": "array",
          "title": "Extensions",
          "description": "Extensions associated with the add-on."
        },
        "stamps": {
          "items": {
            "$ref": "https://gobl.org/draft-0/cbc/definition"
          },
          "type": "array",
          "title": "Stamps",
          "description": "Stamps that may be included in envelope headers by the agency or intermediary\nthe add-on targets, registered in the head package."
        },
        "tags": {
          "items": {
            "$ref": "https://gobl.org/draft-0/tax/tag-set"
          },
          "type": "array",
          "title": "Tags",
          "description": "Tag sets that define what can be assigned to each document schema."
        },
        "scenarios": {
          "items": {
            "$ref": "https://gobl.org/draft-0/tax/scenario-set"
          },
          "type": "array",
          "title": "Scenarios",
          "description": "Applied to documents after normalization and before validation to ensure that\nformat specific extensions have been added."
        },
        "identities": {
          "items": {
            "$ref": "https://gobl.org/draft-0/cbc/definition"
          },
          "type": "array",
          "title": "Identities",
          "description": "Identities that are specific for the add-on and may be validated against or\nused during conversion processes."
        },
        "inboxes": {
          "items": {
            "$ref": "https://gobl.org/draft-0/cbc/definition"
          },
          "type": "array",
          "title": "Inboxes",
          "description": "Keys used to identify where copies of documents can be sent."
        },
        "corrections": {
          "$ref": "https://gobl.org/draft-0/tax/correction-set",
          "title": "Corrections",
          "description": "Correction definitions supported by the add-on."
        }
      },
      "type": "object",
      "required": [
        "key",
        "name",
        "extensions",
        "scenarios",
        "corrections"
      ],
      "description": "AddonDef is an interface that defines the methods that a tax add-on must implement."
    }
  }
}